filename,length(sec),proc_time(sec),wer,actual_text,processed_text
1089-134686-0000.flac,10.435,191.157,0.214,he hoped there would be stew for dinner turnips and carrots and bruised potatoes and fat mutton pieces to be ladled out in thick peppered flour fattened sauce,he hoped there would be stow for dinner turn ips and carrots and bruised potatoes and fat mutton pieces to be latled out in thick peppered flowur fatten sauce
1089-134686-0001.flac,3.275,53.584,0.375,stuff it into you his belly counselled him,stufferd into you his belly counteled him
1089-134686-0002.flac,6.625,110.793,0.111,after early nightfall the yellow lamps would light up here and there the squalid quarter of the brothels,after early nightfall the yellow lamps would light up here and there the squallid quarter of the braffels
1089-134686-0003.flac,2.68,43.519,0.571,hello bertie any good in your mind,oh berty and e good in your mind
1089-134686-0004.flac,5.2150625,87.57,0.273,number ten fresh nelly is waiting on you good night husband,number tan fresh nely is waiting on you could night husband
1089-134686-0005.flac,9.635,159.072,0.043,the music came nearer and he recalled the words the words of shelley's fragment upon the moon wandering companionless pale for weariness,the music came nearer and he recalled the words the words of shelly's fragment upon the moon wandering companionless pale for weariness
1089-134686-0006.flac,10.555,175.262,0.25,the dull light fell more faintly upon the page whereon another equation began to unfold itself slowly and to spread abroad its widening tail,the dull light fell more faintly upon the page where on another requation began to on fold itself slowly and to spread abroad its wideening tail
1089-134686-0007.flac,4.275,69.822,0.125,a cold lucid indifference reigned in his soul,a cold lucid indifference rraigned in his soul
1089-134686-0008.flac,6.73,111.657,0.133,the chaos in which his ardour extinguished itself was a cold indifferent knowledge of himself,the chaos an which his ardour extinguished itself was o cold indifferent knowledge of himself
1089-134686-0009.flac,10.575,160.974,0.037,at most by an alms given to a beggar whose blessing he fled from he might hope wearily to win for himself some measure of actual grace,as most by an alms given to a beggar whose blessing he fled from he might hope wearily to win for himself some measure of actual grace
1089-134686-0010.flac,4.405,62.229,0.214,well now ennis i declare you have a head and so has my stick,well now and is ideclare you have a head and so has my stick
1089-134686-0011.flac,12.445,180.384,0.051,on saturday mornings when the sodality met in the chapel to recite the little office his place was a cushioned kneeling desk at the right of the altar from which he led his wing of boys through the responses,on saturday mornings when the sodality met in the chapel to recit the little office his place was a cushioned neeling desk at the right of the altar from which he led his wing of boys through the responses
1089-134686-0012.flac,11.64,166.147,0.071,her eyes seemed to regard him with mild pity her holiness a strange light glowing faintly upon her frail flesh did not humiliate the sinner who approached her,her eyes seemed to regard him with mild pity per holiness a strange light blowing faintly upon her frail flesh did not humiliate the sinner who approached her
1089-134686-0013.flac,7.915,112.255,0.04,if ever he was impelled to cast sin from him and to repent the impulse that moved him was the wish to be her knight,if ever he was impelled to cast sin from him and to repent the impulse that moved him was the wish to be her night
1089-134686-0014.flac,2.225,31.347,0.0,he tried to think how it could be,he tried to think how it could be
1089-134686-0015.flac,5.815,81.785,0.143,but the dusk deepening in the schoolroom covered over his thoughts the bell rang,but the dusk deepening in the school room covered over his thoughts the bell rang
1089-134686-0016.flac,3.54,48.014,0.2,then you can ask him questions on the catechism dedalus,then you can ask him questions on the catecusm datilus
1089-134686-0017.flac,8.87,122.055,0.125,stephen leaning back and drawing idly on his scribbler listened to the talk about him which heron checked from time to time by saying,stephen leaning back and drawing eedly on his scribler listened to the talk about him which heren checked from time to time by saying
1089-134686-0018.flac,15.72,223.993,0.049,it was strange too that he found an arid pleasure in following up to the end the rigid lines of the doctrines of the church and penetrating into obscure silences only to hear and feel the more deeply his own condemnation,it was strange to that he found an erid pleasure in following up to the end the rigid lines of the doctrines of the church and penetrating into obscure silences only to hear and feel the more deeply his own condemnation
1089-134686-0019.flac,13.895,195.442,0.077,the sentence of saint james which says that he who offends against one commandment becomes guilty of all had seemed to him first a swollen phrase until he had begun to grope in the darkness of his own state,the sentence of saint james which says that he who affends against one commandment becomes guilty of all had seemed to him first a swoll an phrase until he had begun to grope in the darkness of his own state
1089-134686-0020.flac,16.79,240.194,0.16,if a man had stolen a pound in his youth and had used that pound to amass a huge fortune how much was he obliged to give back the pound he had stolen only or the pound together with the compound interest accruing upon it or all his huge fortune,if a man had stold in a pound in his youth and had used that pound to a massa huge fortune how much was he obliged to to give back the pound he had stolen only were the pound together with the compound interest a crewing upon it or all his huge fortune
1089-134686-0021.flac,6.55,93.723,0.235,if a layman in giving baptism pour the water before saying the words is the child baptized,if a lamen in giving bapk tism poor the water before saying the words is the child baptized
1089-134686-0022.flac,11.175,157.127,0.125,how comes it that while the first beatitude promises the kingdom of heaven to the poor of heart the second beatitude promises also to the meek that they shall possess the land,how comes it that while the first be attitude promises the kingdom of heaven to the poor of heart the second the attitude promises also to the meek that they shall possess the land
1089-134686-0023.flac,13.275,185.33,0.056,why was the sacrament of the eucharist instituted under the two species of bread and wine if jesus christ be present body and blood soul and divinity in the bread alone and in the wine alone,why was the sacrament of the ucarist instituted under the two species of bread and wine if jesus christ be present body and blood sol and divinity in the bread alone and in the wine alone
1089-134686-0024.flac,11.655,162.505,0.067,if the wine change into vinegar and the host crumble into corruption after they have been consecrated is jesus christ still present under their species as god and as man,if the wine change into vinegar and the whost crumble inte corruption after they have been consecrated is jesus christ still present under their species as god and as man
1089-134686-0025.flac,6.61,93.753,0.0,a gentle kick from the tall boy in the bench behind urged stephen to ask a difficult question,a gentle kick from the tall boy in the bench behind urged stephen to ask a difficult question
1089-134686-0026.flac,4.01,56.313,0.0,the rector did not ask for a catechism to hear the lesson from,the rector did not ask for a catechism to hear the lesson from
1089-134686-0027.flac,2.71,37.248,0.0,he clasped his hands on the desk and said,he clasped his hands on the desk and said
1089-134686-0028.flac,7.83,110.015,0.111,the retreat will begin on wednesday afternoon in honour of saint francis xavier whose feast day is saturday,the retreat will begin on whednesday afternoon in honour of saint francis zavior whose feast day is saturday
1089-134686-0029.flac,4.67,67.489,0.0,on friday confession will be heard all the afternoon after beads,on friday confession will be heard all the afternoon after beads
1089-134686-0030.flac,2.715,39.009,0.4,beware of making that mistake,beware of making thatmostake
1089-134686-0031.flac,6.615,95.681,0.133,stephen's heart began slowly to fold and fade with fear like a withering flower,stephen's heart begun slowly to fold and fade with fear like a witthering flower
1089-134686-0032.flac,4.09,58.036,0.091,he is called as you know the apostle of the indies,he as called as you know the apostle of the indies
1089-134686-0033.flac,3.33,44.833,0.167,a great saint saint francis xavier,a great saint saint francis zavior
1089-134686-0034.flac,5.81,82.91,0.077,the rector paused and then shaking his clasped hands before him went on,the rector paused and then shaking his claspdto hands before him went on
1089-134686-0035.flac,3.445,46.395,0.0,he had the faith in him that moves mountains,he had the faith in him that moves mountains
1089-134686-0036.flac,3.25,43.336,0.167,a great saint saint francis xavier,a great saint saint francis zavior
1089-134686-0037.flac,5.21,73.194,0.077,in the silence their dark fire kindled the dusk into a tawny glow,in the silence their dark fire kindled the dusk into a tany glow
1188-133604-0000.flac,10.725,152.053,0.316,you will find me continually speaking of four men titian holbein turner and tintoret in almost the same terms,you will find me continually speaking of four men tision hole bine turner and ton cut ut in almost the same terms
1188-133604-0001.flac,9.04,128.794,0.167,they unite every quality and sometimes you will find me referring to them as colorists sometimes as chiaroscurists,thet unite every quality and sometimes you will find me referring to them as colorists sometimes as keras scurouss
1188-133604-0002.flac,17.96,255.078,0.133,by being studious of color they are studious of division and while the chiaroscurist devotes himself to the representation of degrees of force in one thing unseparated light the colorists have for their function the attainment of beauty by arrangement of the divisions of light,by being studious of color they re studious of division and while the curoscurist devotes himself to the represenation of degrees of force in one thing onseparated light the colorists have for their function the attainment of beauty by rangement of the divisions of lighe
1188-133604-0003.flac,12.61,173.166,0.219,my first and principal reason was that they enforced beyond all resistance on any student who might attempt to copy them this method of laying portions of distinct hue side by side,my first imd principale reason was that they inforced beyond all resistance on any student who might avetempt to copy them this method of laing porsons of distinct hug side by side
1188-133604-0004.flac,10.65,154.135,0.219,some of the touches indeed when the tint has been mixed with much water have been laid in little drops or ponds so that the pigment might crystallize hard at the edge,some of the touches indeed when the tinters been mixed with much water have been laid ind little drops or pawnds so that the pagmant might crystal ase hard at the edge
1188-133604-0005.flac,8.56,116.725,0.233,it is the head of a parrot with a little flower in his beak from a picture of carpaccio's one of his series of the life of saint george,does the head of a parrot woth a little flowering his beak from a picture of capotius one of his series of the life of saint george
1188-133604-0006.flac,2.4,33.184,0.0,then he comes to the beak of it,then he comes to the beak of it
1188-133604-0007.flac,14.24,201.501,0.233,the brown ground beneath is left for the most part one touch of black is put for the hollow two delicate lines of dark gray define the outer curve and one little quivering touch of white draws the inner edge of the mandible,the brown ground beneath his left for the most part one touch of black is put for the hollow to dalk at lines of dark gray to find the outer curve and one little quivering touch of white drawsy inter edge of the mandable
1188-133604-0008.flac,20.755,292.111,0.328,for believe me the final philosophy of art can only ratify their opinion that the beauty of a cock robin is to be red and of a grass plot to be green and the best skill of art is in instantly seizing on the manifold deliciousness of light which you can only seize by precision of instantaneous touch,for blieve me the fonolphilosophy of art can only rad ify their opinion that the beauty of a cock rob in this to be read and of a grasp plot to be green and the best skill vart is an instantly seizing on the men afoll deliciousness of light which you can only se as by prucision of instanttaneous touch
1188-133604-0009.flac,23.06,327.499,0.071,now you will see in these studies that the moment the white is inclosed properly and harmonized with the other hues it becomes somehow more precious and pearly than the white paper and that i am not afraid to leave a whole field of untreated white paper all round it being sure that even the little diamonds in the round window will tell as jewels if they are gradated justly,now you will see in these studies that the moment the whites andclosed properly and harmonized with the other hues it becomes somehow more precious and pearly in the white paper and that i am not afraid to leave a whole field of untreated white paper all round it being sure that even the little diamonds in the round window will tell as jeels if they are gradated justly
1188-133604-0010.flac,6.095,87.455,0.2,but in this vignette copied from turner you have the two principles brought out perfectly,but in this vinia copied from terner you had the two principles brought out perfectly
1188-133604-0011.flac,15.19,211.026,0.098,they are beyond all other works that i know existing dependent for their effect on low subdued tones their favorite choice in time of day being either dawn or twilight and even their brightest sunsets produced chiefly out of gray paper,they are beyond all other works than i know existing dependent for their effect on low subdued tones their favorite thoice in time of day being either dawn or twilight and even their bright des sunsets produced chiefly out of gray paper
1188-133604-0012.flac,14.65,206.609,0.263,it may be that a great colorist will use his utmost force of color as a singer his full power of voice but loud or low the virtue is in both cases always in refinement never in loudness,it may be that a great coloraliss will uses udmost force of colar as a singer his full power of voice but loud or lil the virtue is in both cases always in re finement never nlowdness
1188-133604-0013.flac,3.02,41.23,0.0,it must remember be one or the other,it must remember be one or the other
1188-133604-0014.flac,4.39,60.981,0.417,do not therefore think that the gothic school is an easy one,do not therefore think that the goth e schools neesy one
1188-133604-0015.flac,16.085,233.266,0.122,the law of that school is that everything shall be seen clearly or at least only in such mist or faintness as shall be delightful and i have no doubt that the best introduction to it would be the elementary practice of painting every study on a golden ground,the law of that schools that everything shall be seen clearly whor least only in such mister faintness as shall be delightful and i have no doubt that the best introduction to it would be the elementary practice of painting every study on a golden ground
1188-133604-0016.flac,16.595,236.89,0.233,this at once compels you to understand that the work is to be imaginative and decorative that it represents beautiful things in the clearest way but not under existing conditions and that in fact you are producing jeweler's work rather than pictures,this it once compes you to understand that the work is to be imaginative andecorative that it rebresents beautiful things in the clearest way but not under existing conditions and that in fact your producing juwelers work rather than tectures
1188-133604-0017.flac,4.615,66.912,0.4,that a style is restrained or severe does not mean that it is also erroneous,that a styles re strained or severed does not mean that it is also a runius
1188-133604-0018.flac,11.5499375,166.107,0.182,in all early gothic art indeed you will find failure of this kind especially distortion and rigidity which are in many respects painfully to be compared with the splendid repose of classic art,in all orly gothacgarten deed you will find failure of this kind especially distortion in rigidity which are in many respects painfully to be compared with the splendid ropose of classic art
1188-133604-0019.flac,13.93,198.6,0.125,the large letter contains indeed entirely feeble and ill drawn figures that is merely childish and failing work of an inferior hand it is not characteristic of gothic or any other school,the large letter contains indeed entirely feeble an ill drawn figures that is merely child is and failing work of an efer hand it is not characteristic of gothic or any other school
1188-133604-0020.flac,10.26,145.786,0.04,but observe you can only do this on one condition that of striving also to create in reality the beauty which you seek in imagination,but observe you can only do this on one condition that of striving also to create in reality the beauty which you seek in amagination
1188-133604-0021.flac,14.02,199.084,0.194,it will be wholly impossible for you to retain the tranquillity of temper and felicity of faith necessary for noble purist painting unless you are actively engaged in promoting the felicity and peace of practical life,it wild beholly impossible for you to retain the tranquillity of temper and felicity of faith necessary from noble piurest painting unless you are actively engaged in promoting the folicityan peace of practical life
1188-133604-0022.flac,9.63,136.609,0.069,you must look at him in the face fight him conquer him with what scathe you may you need not think to keep out of the way of him,you must look at him in the face fight him conquer him with what scate you may you need not think the keep out of the way of him
1188-133604-0023.flac,23.67,332.392,0.088,the colorist says first of all as my delicious paroquet was ruby so this nasty viper shall be black and then is the question can i round him off even though he is black and make him slimy and yet springy and close down clotted like a pool of black blood on the earth all the same,the colorist says first of all as my delicious paracey was ruby so this nasty viper shall be black and then is the question can i round him off even though he is black and make him slym me and yet springing and close down clotded like a pool of black blood on the earth all the same
1188-133604-0024.flac,15.24,218.257,0.133,nothing will be more precious to you i think in the practical study of art than the conviction which will force itself on you more and more every hour of the way all things are bound together little and great in spirit and in matter,nothing will be more precious to you i think in the practical study of art then the conviction which will force itself un you moreand more every hour of the way ofl things are bound together little an great in spirit and in matter
1188-133604-0025.flac,7.45,107.727,0.217,you know i have just been telling you how this school of materialism and clay involved itself at last in cloud and fire,you know i've just been telling you how this school materialism in clay and volved itself at last and cloud and fire
1188-133604-0026.flac,20.125,285.372,0.294,here is an equally typical greek school landscape by wilson lost wholly in golden mist the trees so slightly drawn that you don't know if they are trees or towers and no care for color whatever perfectly deceptive and marvelous effect of sunshine through the mist apollo and the python,hereis nequally typical greek school landscape by wilson lost holly and golden nist the trees so slightly drawn that you don't know if they are trees were towers and no care for color whatsoever perfectly deceptive in marvelous affect of sunshine through the mest u pollo and the pithan
1188-133604-0027.flac,11.245,154.679,0.167,now here is raphael exactly between the two trees still drawn leaf by leaf wholly formal but beautiful mist coming gradually into the distance,now here is rough ile exactly between the two trees still drawn leaf by leaf holy formal but beautiful nist coming gradually into the distance
1188-133604-0028.flac,19.005,269.855,0.178,well then last here is turner's greek school of the highest class and you define his art absolutely as first the displaying intensely and with the sternest intellect of natural form as it is and then the envelopment of it with cloud and fire,while then last he resturns greek school of the highest class and you define his art absolutely as first the desplaying intensely and with the sternest intellect of natural form as it is and thin the invelopment of it with cloud and fire
1188-133604-0029.flac,3.705,51.961,0.111,only there are two sorts of cloud and fire,only there are two sorts of cloud in fire
1188-133604-0030.flac,1.915,25.156,0.0,he knows them both,he knows them both
1188-133604-0031.flac,4.25,58.098,0.083,there's one and there's another the dudley and the flint,there's one and there's another the doudly and the flint
1188-133604-0032.flac,10.985,155.189,0.241,it is only a pencil outline by edward burne jones in illustration of the story of psyche it is the introduction of psyche after all her troubles into heaven,it is only a pencsyl outline by edward burne jones an illustration of the story of sychi it is the introduction of psychi after all her troubles in to haveem
1188-133604-0033.flac,6.625,94.724,0.0,every plant in the grass is set formally grows perfectly and may be realized completely,every plant in the grass is set formally grows perfectly and may be realized completely
1188-133604-0034.flac,20.905,292.82,0.107,exquisite order and universal with eternal life and light this is the faith and effort of the schools of crystal and you may describe and complete their work quite literally by taking any verses of chaucer in his tender mood and observing how he insists on the clearness and brightness first and then on the order,exquisite order and universal with e tornal life and light this is the faith an effort of the schools of crystal and you may discribe and complete their work quite literally by taking any verses of choucer in his tender mood and observing how he insists on the clearness and brightness first and then on the oer
1188-133604-0035.flac,2.925,40.085,0.4,thus in chaucer's dream,thus in chareers dream
1188-133604-0036.flac,7.97,109.32,0.188,in both these high mythical subjects the surrounding nature though suffering is still dignified and beautiful,in both des hin myshical subjects the surrounding nature though suffering is still dignified and beautiful
1188-133604-0037.flac,14.51,204.303,0.154,every line in which the master traces it even where seemingly negligent is lovely and set down with a meditative calmness which makes these two etchings capable of being placed beside the most tranquil work of holbein or duerer,every line in which the master traces it even were seemingly negligent is lovely and set down with a meditative calmness which makes these two edgings capable of being placed beside the most tranquil work of hole bine would dur
1188-133604-0038.flac,5.365,73.285,0.158,but now here is a subject of which you will wonder at first why turner drew it at all,but now hereis a subject of which you will wonder it first why turner drew it at all
1188-133604-0039.flac,6.625,90.418,0.176,it has no beauty whatsoever no specialty of picturesqueness and all its lines are cramped and poor,as no beauty whatsoever no specialty of picturesquedness and all its lines are cramped and poor
1188-133604-0040.flac,3.23,44.392,0.25,the crampness and the poverty are all intended,the crantness in the poverty are all intended
1188-133604-0041.flac,10.07,151.287,0.074,it is a gleaner bringing down her one sheaf of corn to an old watermill itself mossy and rent scarcely able to get its stones to turn,it is a gleaner bringing down her one sheef of corn to an old watermill itself mossy and rent scarcely able to get it stones to turn
1188-133604-0042.flac,2.66,39.683,0.2,the scene is absolutely arcadian,the scene is absolutely orcadian
1188-133604-0043.flac,4.885,71.967,0.176,see that your lives be in nothing worse than a boy's climbing for his entangled kite,see that your lives be in nothing worse than a boys climbing for his entangled cite
1188-133604-0044.flac,18.545,280.881,0.14,it will be well for you if you join not with those who instead of kites fly falcons who instead of obeying the last words of the great cloud shepherd to feed his sheep live the lives how much less than vanity of the war wolf and the gier eagle,it will be well for you if you joined not with those who instead of kites fly folcons who instead of obeying the last words of the great cloud shephard to feed his sheep lived the lives how much less than vanity of the wor wolf and the gerygal
121-121726-0000.flac,8.46,126.37,0.353,also a popular contrivance whereby love making may be suspended but not stopped during the picnic season,also a papular condrivance were by love making may be suspended but not stoped during the picnic eason
121-121726-0001.flac,5.925,88.399,0.5,harangue the tiresome product of a tireless tongue,her rang the tire some product of a tireless tongue
121-121726-0002.flac,4.41,65.344,0.8,angor pain painful to hear,angle hain voll to her
121-121726-0003.flac,6.755,100.786,0.071,hay fever a heart trouble caused by falling in love with a grass widow,hay fever a heard trouble caused by falling in love with a grass widow
