filename,length(sec),proc_time(sec),wer,actual_text,processed_text
4507-16021-0032.flac,28.09,395.931,0.177,he must descend with his heart full of charity and severity at the same time as a brother and as a judge to those impenetrable casemates where crawl pell mell those who bleed and those who deal the blow those who weep and those who curse those who fast and those who devour those who endure evil and those who inflict it,he must descend with his heart full of charity and severity at the same time as a brother and as a judge to those impenetrable case mates wore crawl pel mell those who beliedd in those who deal the blow those who weep ind those who course those who fast and those who devour those who windore evil and those who inflicted
4507-16021-0033.flac,5.545,76.554,0.067,do we really know the mountain well when we are not acquainted with the cavern,do we relly know the mountain well when we are not acquainted with the cavern
4507-16021-0034.flac,11.27,160.19,0.091,they constitute two different orders of facts which correspond to each other which are always interlaced and which often bring forth results,they constitute to different orders of facts which correspond to each other which are always intolacte and which often bring forth results
4507-16021-0035.flac,7.535,104.27,0.357,true history being a mixture of all things the true historian mingles in everything,two history being imixture of all things the true histori an mingles in everything
4507-16021-0036.flac,5.435,75.822,0.0,facts form one of these and ideas the other,facts form one of these and ideas the other
4507-16021-0037.flac,5.35,81.416,0.1,there it clothes itself in word masks in metaphor rags,there it clothes itself in word masks in megiphor rags
4507-16021-0038.flac,3.885,57.995,0.167,in this guise it becomes horrible,in this skise it becomes horrible
4507-16021-0039.flac,15.42,231.324,0.348,one perceives without understanding it a hideous murmur sounding almost like human accents but more nearly resembling a howl than an articulate word,one peceives without understanding it a hideous murmur sanding almost like human acts ance but more nearly resembling a howll than in articularr to word
4507-16021-0040.flac,3.925,58.61,0.833,one thinks one hears hydras talking,one things one hers high dress tolking
4507-16021-0041.flac,2.975,44.553,0.333,it is unintelligible in the dark,it is unteligible in the dork
4507-16021-0042.flac,10.375,155.464,0.353,it is black in misfortune it is blacker still in crime these two blacknesses amalgamated compose slang,it is black and misfortune it is block or still an crime these two blacknesses a molgemated compose slang
4507-16021-0043.flac,3.99,56.829,0.3,the earth is not devoid of resemblance to a jail,the earth is not di void of resemblance to a chail
4507-16021-0044.flac,2.19,32.403,0.0,look closely at life,look closely at life
4507-16021-0045.flac,4.89,73.588,0.167,it is so made that everywhere we feel the sense of punishment,it is so mad that everywhere we feel the sense of conishment
4507-16021-0046.flac,4.59,67.516,0.091,each day has its own great grief or its little care,each day has its own great grief or wits little care
4507-16021-0047.flac,34.955,527.585,0.13,yesterday you were trembling for a health that is dear to you to day you fear for your own to morrow it will be anxiety about money the day after to morrow the diatribe of a slanderer the day after that the misfortune of some friend then the prevailing weather then something that has been broken or lost then a pleasure with which your conscience and your vertebral column reproach you again the course of public affairs,yes strer day you were trembling fr a health that is dear to you to day you fear for your own to morrow it will be anxiety about money the day after to morrow the diattribe of a sland er the day after that the misfortune of some friend then the prevailing weather then something that is been broken or lost then a pleasure with which your conscience and your verterbal column repoach you again the course of public affairs
4507-16021-0048.flac,5.215,77.954,0.143,this without reckoning in the pains of the heart and so it goes on,this without reckoning in the pains of the heart and so to go on
4507-16021-0049.flac,5.91,88.002,0.0,there is hardly one day out of a hundred which is wholly joyous and sunny,there is hardly one day out of a hundred which is wholly joyous and sunny
4507-16021-0050.flac,3.895,56.336,0.1,and you belong to that small class who are happy,and you belonged to that small class who are happy
4507-16021-0051.flac,6.17,90.97,0.5,in this world evidently the vestibule of another there are no fortunate,in this world's evidently the vest if youl of another there are no fortune at
4507-16021-0052.flac,6.275,93.982,0.0,the real human division is this the luminous and the shady,the real human division is this the luminous and the shady
4507-16021-0053.flac,8.095,122.04,0.167,to diminish the number of the shady to augment the number of the luminous that is the object,to deminish the number of the shavy to ugment the number of the luminous that is the object
4507-16021-0054.flac,4.315,66.54,0.286,that is why we cry education science,that is why we cry edgucation sience
4507-16021-0055.flac,7.225,109.058,0.154,to teach reading means to light the fire every syllable spelled out sparkles,to teach reading means to light the fire every silble sfelled out sparkles
4507-16021-0056.flac,6.345,96.51,0.1,however he who says light does not necessarily say joy,however he who says light does not necessarily say toy
4507-16021-0057.flac,4.61,68.529,0.286,people suffer in the light excess burns,people soffer and the light excess burns
4507-16021-0058.flac,3.11,46.926,0.0,the flame is the enemy of the wing,the flame is the enemy of the wing
4507-16021-0059.flac,6.205,91.272,0.25,to burn without ceasing to fly therein lies the marvel of genius,to burn without ceasing to fly there in lies the marvel of cenius
4970-29093-0000.flac,3.03,45.541,0.3,you'll never dig it out of the astor library,iu'll never dig it out of the astera wibrary
4970-29093-0001.flac,11.92,180.345,0.103,to the young american here or elsewhere the paths to fortune are innumerable and all open there is invitation in the air and success in all his wide horizon,to the young american here or elsewhere the pats to fortune are an umerable and all open there is invitation in the air and success in all his wide horizon
4970-29093-0002.flac,10.73,160.656,0.161,he has no traditions to bind him or guide him and his impulse is to break away from the occupation his father has followed and make a new way for himself,he has no traditions to bind him or guide him and his impules is to break away from the occupation is father has fallowed and maka new way for himself
4970-29093-0003.flac,15.355,228.677,0.071,the modest fellow would have liked fame thrust upon him for some worthy achievement it might be for a book or for the skillful management of some great newspaper or for some daring expedition like that of lieutenant strain or doctor kane,the modest fellow would have liked fame thrus upon him for some worthy achievement it might be for a book or for the skillful management of some great newspaper or for some daring expedition like that of lutenante strain or doctor came
4970-29093-0004.flac,3.75,54.548,0.2,he was unable to decide exactly what it should be,he was unable to decide exactly what ithould be
4970-29093-0005.flac,22.16,307.669,0.286,sometimes he thought he would like to stand in a conspicuous pulpit and humbly preach the gospel of repentance and it even crossed his mind that it would be noble to give himself to a missionary life to some benighted region where the date palm grows and the nightingale's voice is in tune and the bul bul sings on the off nights,sometimes you thought he would like to stand and at conspicious pullbit and humbly preached the gospel of repentance and id even crossis mind that it would be noble to give himself to a missionary life to some benited region were the date palm grows an the nightingills voice is in tune and the bulbule sangs on the oft nights
4970-29093-0006.flac,29.6,426.063,0.333,law seemed to him well enough as a science but he never could discover a practical case where it appeared to him worth while to go to law and all the clients who stopped with this new clerk in the ante room of the law office where he was writing philip invariably advised to settle no matter how but settle greatly to the disgust of his employer who knew that justice between man and man could only be attained by the recognized processes with the attendant fees,was into him wile en ap os a science but he never could discover a practical case werd appured to him worth wild to go to law and all the clients who stopped with the snew clerk and the anti room of the wall oppose where he was riting philipp ing veriably advise to settle no matter how but settle greatly to the discust of phys imployer who knew the jestice between man and man could only be attained by the recognized processes with the atendant beads
4970-29093-0007.flac,6.995,96.889,0.056,it is such a noble ambition that it is a pity it has usually such a shallow foundation,it is such a noble ambition that it is a pity it has usually such a shallow foundnation
4970-29093-0008.flac,3.58,51.957,0.1,he wanted to begin at the top of the ladder,he wanted to begin at the top of the watter
4970-29093-0009.flac,9.12,132.314,0.579,philip therefore read diligently in the astor library planned literary works that should compel attention and nursed his genius,phil of ther fore red villageently in the aster wibrary planed liteary works that should compell attention and nursed his genius
4970-29093-0010.flac,14.3,204.44,0.143,he had no friend wise enough to tell him to step into the dorking convention then in session make a sketch of the men and women on the platform and take it to the editor of the daily grapevine and see what he could get a line for it,he had no friend wise enough to tell him to set into the dorting convencion then in session make a sketch of the men and women on the platform and take it to the editor of the daily grat vine and see what he could get aline for it
4970-29093-0011.flac,11.45,166.011,0.242,o very well said gringo turning away with a shade of contempt you'll find if you are going into literature and newspaper work that you can't afford a conscience like that,oh very well said gring out turning away with a shad if contempt bu'll find if you are going unto literature and neuspaple work that you can't afford a conscience like that
4970-29093-0012.flac,8.71,124.276,0.28,but philip did afford it and he wrote thanking his friends and declining because he said the political scheme would fail and ought to fail,but till ob dit aford it and he wrote thankking his friends and eclinbing because he said the plitical scheme would fail and ought to fail
4970-29093-0013.flac,8.01,110.18,0.083,and he went back to his books and to his waiting for an opening large enough for his dignified entrance into the literary world,and he went back to his books and to his waiting for an opening large enufh for his dignified interance into the literary world
4970-29093-0014.flac,4.275,61.03,0.25,well i'm going as an engineer you can go as one,while i'm going as an ingimeer you could go as one
4970-29093-0015.flac,3.325,45.425,0.0,you can begin by carrying a rod and putting down the figures,you can begin by carrying a rod and putting down the figures
4970-29093-0016.flac,2.23,30.105,0.6,no its not too soon,no it's not to soon
4970-29093-0017.flac,2.865,39.69,0.6,i've been ready to go anywhere for six months,adbe watye to go any rhare for six months
4970-29093-0018.flac,9.715,136.751,0.0,the two young men who were by this time full of the adventure went down to the wall street office of henry's uncle and had a talk with that wily operator,the two young men who were by this time full of the adventure went down to the wall street office of henry's uncle and had a talk with that wily operator
4970-29093-0019.flac,7.47,109.937,0.174,the night was spent in packing up and writing letters for philip would not take such an important step without informing his friends,the night was spent in packing up and riting letters for fhilip would not take such an implortant step ofout informing his friends
4970-29093-0020.flac,5.58,81.517,0.25,why it's in missouri somewhere on the frontier i think we'll get a map,why it's in missouri somewhere on the front tier i think w'll get a ap
4970-29093-0021.flac,2.425,33.875,0.143,i was afraid it was nearer home,i was afraid it was nearher home
4970-29093-0022.flac,6.22,89.039,0.095,he knew his uncle would be glad to hear that he had at last turned his thoughts to a practical matter,he knew his uncle would be glad to hear that he had at last hernd his thoughts to wa practical matter
4970-29093-0023.flac,8.07,112.726,0.0,he well knew the perils of the frontier the savage state of society the lurking indians and the dangers of fever,he well knew the perils of the frontier the savage state of society the lurking indians and the dangers of fever
4992-23283-0000.flac,6.645,93.887,0.0,but the more forgetfulness had then prevailed the more powerful was the force of remembrance when she awoke,but the more forgetfulness had then prevailed the more powerful was the force of remembrance when she awoke
4992-23283-0001.flac,2.71,37.079,0.429,miss milner's health is not good,miss milners holh is not good
4992-23283-0002.flac,3.12,43.801,0.0,said missus horton a few minutes after,said missus horton a few minutes after
4992-23283-0003.flac,4.645,64.925,0.364,so there is to me added sandford with a sarcastic sneer,so there is to ma added sanfrd with a carcuastics near
4992-23283-0004.flac,8.06,111.343,0.05,and yet you must own her behaviour has warranted them has it not been in this particular incoherent and unaccountable,and yet you must own her behaviour has warnted them has it not been in this particular incoherent and unaccountable
4992-23283-0005.flac,10.74,153.29,0.091,not that i know of not one more that i know of he replied with astonishment at what she had insinuated and yet with a perfect assurance that she was in the wrong,not that i know of not one more that i know of he replied with a stonishment at what she had insinuated and yet with a perfect essurance that she was in the wrong
4992-23283-0006.flac,2.965,40.979,0.5,perhaps i am mistaken answered she,perhaps i am tistake in answerd she
4992-23283-0007.flac,4.045,56.464,0.0,to ask any more questions of you i believe would be unfair,to ask any more questions of you i believe would be unfair
4992-23283-0008.flac,4.91,67.351,0.143,he seemed to wait for her reply but as she made none he proceeded,he seemed to wait for her reply but as she made non he perceeded
4992-23283-0009.flac,8.395,115.734,0.25,oh my lord cried miss woodley with a most forcible accent you are the last person on earth she would pardon me for entrusting,oh my lord cried miss wioly wina most forceible accent you are the last personal on earth she would pardon me for interusting
4992-23283-0010.flac,5.0,70.541,0.188,but in such a case miss milner's election of a husband shall not direct mine,but in such o case miss molners election of a husband shall not direct mine
4992-23283-0011.flac,4.225,59.439,0.077,if she does not know how to estimate her own value i do,if she does not know how to estimate her own balue i do
4992-23283-0012.flac,21.735,318.887,0.213,independent of her fortune she has beauty to captivate the heart of any man and with all her follies she has a frankness in her manner an unaffected wisdom in her thoughts a vivacity in her conversation and withal a softness in her demeanour that might alone engage the affections of a man of the nicest sentiments and the strongest understanding,in ependant of her fortune she has beauty to captivate the heart of any man and with alher follis she has a frankness in her manner and unaffected wisdom in her thoughts of a vacity in her conversation and with all a softness in her demeanor that might alone angage the effections of a man of the nicest sentiments and the strongest understanding
4992-23283-0013.flac,6.63,97.813,0.188,my lord miss milner's taste is not a depraved one it is but too refined,my lord miss millers taste is not a depraved one it is but too refind
4992-23283-0014.flac,4.535,66.914,0.091,what can you mean by that miss woodley you talk mysteriously,what can you mean by that miss woodley you talk misteriously
4992-23283-0015.flac,3.675,54.104,0.2,is she not afraid that i will thwart her inclinations,is she not afraid that i will word her anclinations
4992-23283-0016.flac,4.495,67.219,0.2,again he searched his own thoughts nor ineffectually as before,again he searched his own thoughts nor in affectually as before
4992-23283-0017.flac,14.315,215.837,0.146,miss woodley was too little versed in the subject to know this would have been not to love at all at least not to the extent of breaking through engagements and all the various obstacles that still militated against their union,miss woodley was too little verse in the subject to know this would have been not to love at all at least not to the extent of breaking through engagements at all the baries obs tacles that still medigated against their union
4992-23283-0018.flac,6.575,100.693,0.0,to relieve her from both he laid his hand with force upon his heart and said do you believe me,to relieve her from both he laid his hand with force upon his heart and said do you believe me
4992-23283-0019.flac,6.585,97.614,0.105,i will make no unjust use of what i know he replied with firmness i believe you my lord,i will make no unjust yo use a what i know he replied with firmness i believe you my lord
4992-23283-0020.flac,10.42,157.106,0.125,i have never yet however been vanquished by them and even upon this occasion my reason shall combat them to the last and my reason shall fail me before i do wrong,i had never yet however been vanquished by them and even upon this occasion my reason shall come bat them to the last than my reason shall fail me before i do wrong
5105-28233-0000.flac,4.51,66.394,0.0,length of service fourteen years three months and five days,length of service fourteen years three months and five days
5105-28233-0001.flac,4.49,65.903,0.0,he seemed born to please without being conscious of the power he possessed,he seemed born to please without being conscious of the power he possessed
5105-28233-0002.flac,8.285,125.757,0.0,it must be owned and no one was more ready to confess it than himself that his literary attainments were by no means of a high order,it must be owned and no one was more ready to confess it than himself that his literary attainments were by no means of a high order
5105-28233-0003.flac,14.81,227.367,0.125,we don't spin tops is a favorite saying amongst artillery officers indicating that they do not shirk their duty by frivolous pursuits but it must be confessed that servadac being naturally idle was very much given to spinning tops,we don't spend tops is a favorite saying amongst our tilery officers indicating that they do not shirk their duty by frivolous pursuits but it must be confessed that serva tack being naturally idle was very much given to spinning tops
5105-28233-0004.flac,4.735,72.326,0.308,once in action he was leading a detachment of infantry through an intrenchment,once an action he was leading at a tachment of imfantry through an intrenchment
5105-28233-0005.flac,11.39,173.679,0.054,sometimes he would wander on foot upon the sandy shore and sometimes he would enjoy a ride along the summit of the cliff altogether being in no hurry at all to bring his task to an end,sometimes whe would wander on foot upon the sandy shore sometimes he would enjoy a ride along the summit of the cliff altogether being in no hurry at all to bring his task to an end
5105-28233-0006.flac,5.505,82.255,0.308,no cathedral not even burgos itself could vie with the church at montmartre,no cathedral at even burges itself could vi with the church at momarcha
5105-28233-0007.flac,26.14,397.61,0.23,ben zoof's most ambitious desire was to induce the captain to go with him and end his days in his much loved home and so incessantly were servadac's ears besieged with descriptions of the unparalleled beauties and advantages of this eighteenth arrondissement of paris that he could scarcely hear the name of montmartre without a conscious thrill of aversion,bends of most mbitious desire west to induce the captain to go with him and end his days in his much loved home and so incessantly were serva ac ears beseeged with descriptions of the unperallel beauties and advantages of this eighteenth oure undecemmal of paris that he could scarcely hear the name of monmarchra without a conscious thrill of a version
5105-28233-0008.flac,10.73,162.36,0.061,when a private in the eighth cavalry he had been on the point of quitting the army at twenty eight years of age but unexpectedly he had been appointed orderly to captain servadac,when a private an the eipe cavalry he had been on the point of quitting the army at twenty eight years of age but unexpectedly he had been appointed orderly to captain servadac
5105-28233-0009.flac,14.595,216.198,0.05,the bond of union thus effected could never be severed and although ben zoof's achievements had fairly earned him the right of retirement he firmly declined all honors or any pension that might part him from his superior officer,the bond of union thus effected could never be severed and although ben ofs achievements had fairly earned him the right of retirement he firmly declined all honors or any pension that might part him from his superior officer
5105-28233-0010.flac,13.595,206.245,0.229,unlike his master he made no pretension to any gift of poetic power but his inexhaustible memory made him a living encyclopaedia and for his stock of anecdotes and trooper's tales he was matchless,i mi as master he made no pretension to any gift of poetic power but his inexhaustible memory made him a living in cyclopedia and for his stock of anecdotes and troopers tales he was matcheless
5142-33396-0000.flac,2.005,28.608,0.0,at another time harald asked,at another time harald asked
5142-33396-0001.flac,5.02,74.944,0.375,what is your country olaf have you always been a thrall the thrall's eyes flashed,what is your contry all off have you always been a thral the thrawls eyes flashed
5142-33396-0002.flac,3.67,53.691,0.167,two hundred warriors feasted in his hall and followed him to battle,twoo hundred waryers feasted in his hall and followed him to battle
5142-33396-0003.flac,3.47,51.535,0.273,the rest of you off a viking he had three ships,the rest of you owf of vyking he had three ships
5142-33396-0004.flac,2.215,34.33,0.5,these he gave to three of my brothers,bes to gave to three o fie brothers
5142-33396-0005.flac,2.225,32.897,0.3,but i stayed that spring and built me a boat,but i sayed that spring in built my a boat
5142-33396-0006.flac,6.23,93.648,0.273,i made her for only twenty oars because i thought few men would follow me for i was young fifteen years old,i made her fronly twenty oars because i thought you men would follow me proba was yong fifteen years old
5142-33396-0007.flac,4.975,73.639,0.2,at the prow i carved the head with open mouth and forked tongue thrust out,at the prowi carf the head with open mouth and forked tongue thrust out
5142-33396-0008.flac,2.11,31.758,0.0,i painted the eyes red for anger,i painted the eyes red for anger
5142-33396-0009.flac,3.37,51.1,0.5,there stand so i said and glare and hiss at my foes,there sand so a said and glare in his sis my sos
5142-33396-0010.flac,3.455,51.551,0.429,in the stern i curved the tail up almost as high as the head,in a star i carvof the tal of almost as high as the had
5142-33396-0011.flac,3.52,51.829,0.286,there she sat on the rollers as fair a ship as i ever saw,there she sat on the roller s's fair ship as i ever saw
5142-33396-0012.flac,4.59,68.464,0.111,then i will get me a farm and will winter in that land now who will follow me,then i will get me a farm and will wint her in that land now who will follow me
5142-33396-0013.flac,2.11,29.867,0.375,he is but a boy the men said,is but a boy than then said
5142-33396-0014.flac,3.245,47.309,0.1,thirty men one after another raised their horns and said,thirty men one after another raised their worns and said
5142-33396-0015.flac,4.31,64.059,0.059,as our boat flashed down the rollers into the water i made this song and sang it,as our boat flashed down the rollers into the water i made this song in sang it
5142-33396-0016.flac,2.165,32.558,0.0,so we harried the coast of norway,so we harried the coast of norway
5142-33396-0017.flac,2.635,39.06,0.375,we ate at many men's tables uninvited,we ate it many men's tables on invited
5142-33396-0018.flac,3.94,57.699,0.154,my dragon's belly is never full and on board went the gold,i dragon's belly is never full and on board wint the gold
5142-33396-0019.flac,4.985,73.314,0.05,oh it is better to live on the sea and let other men raise your crops and cook your meals,oh wit is better to live on the sea and let other men raise your crops and cook your meals
5142-33396-0020.flac,3.315,49.722,0.3,a house smells of smoke a ship smells of frolic,a house smells es smoke a ship's smells of fralic
5142-33396-0021.flac,3.505,52.809,0.214,up and down the water we went to get much wealth and much frolic,up and down the water wen went to get much wellth and much fralic
5142-33396-0022.flac,4.77,68.812,0.429,what of the farm olaf not yet i answered viking is better for summer,what af the farm all lofe not yet i answered byking his better for sommer
