filename,length(sec),proc_time(sec),wer,actual_text,processed_text
672-122797-0063.flac,5.075,73.102,0.1,then good bye said the rats and they went home,then good by said the rats and they went home
672-122797-0064.flac,15.27,215.448,0.091,at last the little mice stayed away also and the tree sighed after all it was very pleasant when the sleek little mice sat round me and listened to what i told them,at last the little mice stayed away also and the tree sided after all it was very pleasant when the sleak little mi sat round me and listened to what i told them
672-122797-0065.flac,3.03,43.221,0.2,now that too is over,now that to is over
672-122797-0066.flac,4.815,70.208,0.0,why one morning there came a quantity of people and set to work in the loft,why one morning there came a quantity of people and set to work in the loft
672-122797-0067.flac,13.035,190.514,0.0,the trunks were moved the tree was pulled out and thrown rather hard it is true down on the floor but a man drew him towards the stairs where the daylight shone,the trunks were moved the tree was pulled out and thrown rather hard it is true down on the floor but a man drew him towards the stairs where the daylight shone
672-122797-0068.flac,4.02,57.63,0.3,but it was not the fir tree that they meant,but it was not the firtree that they ment
672-122797-0069.flac,5.01,72.476,0.0,it was in a corner that he lay among weeds and nettles,it was in a corner that he lay among weeds and nettles
672-122797-0070.flac,6.27,93.654,0.056,the golden star of tinsel was still on the top of the tree and glittered in the sunshine,the golden star of tinsil was still on the top of the tree and glittered in the sunshine
672-122797-0071.flac,8.875,136.917,0.172,in the court yard some of the merry children were playing who had danced at christmas round the fir tree and were so glad at the sight of him,in the courtyard some of the marriage shiuldren were playing who had danced at chrispmas round the fir tree and were so glad at the sight of him
672-122797-0072.flac,7.94,120.588,0.222,and the gardener's boy chopped the tree into small pieces there was a whole heap lying there,and the guardeners boy shopped the tree into small pieces there was a whole heap blying there
672-122797-0073.flac,8.205,121.545,0.333,the wood flamed up splendidly under the large brewing copper and it sighed so deeply,the wood flame dop splendidly under the large bruwing copper and it side so teaply
672-122797-0074.flac,8.73,130.559,0.077,however that was over now the tree gone the story at an end,however that was over now the tree gone the story had an end
6829-68769-0000.flac,11.695,179.072,0.27,kenneth and beth refrained from telling the other girls or uncle john of old will rogers's visit but they got mister watson in the library and questioned him closely about the penalty for forging a check,te the phen bethhre frame from delling the other girls or uncle john of old will rogers visit but they got mister waton in the library and questioned him closely about the penalty for fortun a jeck
6829-68769-0001.flac,9.315,141.049,0.194,it was a serious crime indeed mister watson told them and tom gates bade fair to serve a lengthy term in state's prison as a consequence of his rash act,it was a serious crime indeed mister waton told them and tom gates bage fair to serve a length e term in thes states prison as a consequence of his rash act
6829-68769-0002.flac,3.075,46.091,0.083,i can't see it in that light said the old lawyer,i gan't see it in that light said the old lawyer
6829-68769-0003.flac,4.215,61.202,0.143,it was a deliberate theft from his employers to protect a girl he loved,it was a deliberate seft from his imployers to protect a girl he loved
6829-68769-0004.flac,7.145,109.262,0.2,but they could not have proven a case against lucy if she was innocent and all their threats of arresting her were probably mere bluff,but they could not have proven agase against lucy if she was innocent and all their threats of a resting her were probably a mere bluff
6829-68769-0005.flac,6.72,100.331,0.3,he was soft hearted and impetuous said beth and being in love he didn't stop to count the cost,he was sow tarted an impetuous said beth and being un love he didn't stout to caunt the cost
6829-68769-0006.flac,7.195,109.342,0.12,if the prosecution were withdrawn and the case settled with the victim of the forged check then the young man would be allowed his freedom,fif the prosecution werd withdrawn and the case settled with the victim of the forth check then the young man would be allowed his freedom
6829-68769-0007.flac,3.865,57.044,0.308,but under the circumstances i doubt if such an arrangement could be made,but under the circumstances idabti such an arangement could be made
6829-68769-0008.flac,4.74,71.657,0.188,fairview was twelve miles away but by ten o'clock they drew up at the county jail,far viewwas twelve miles away but by ten o'clock they drew up at the county drail
6829-68769-0009.flac,4.22,64.358,0.188,they were received in the little office by a man named markham who was the jailer,they were eceived in the little office by a man name markam who was the jailer
6829-68769-0010.flac,3.14,46.811,0.222,we wish to talk with him answered kenneth talk,we wishe to talk with him fancswered kenneth talk
6829-68769-0011.flac,4.685,69.781,0.333,i'm running for representative on the republican ticket said kenneth quietly,i'm running for representative on their republic onticket said kenneth cuietly
6829-68769-0012.flac,4.295,63.426,0.4,oh say that's different observed markham altering his demeanor,ow say that's different observed markem altering is domeater
6829-68769-0013.flac,2.725,41.316,0.375,may we see gates at once asked kenneth,may be see gates at once ask canneth
6829-68769-0014.flac,3.655,54.626,0.111,they followed the jailer along a succession of passages,they followed the jailer along his succession of passages
6829-68769-0015.flac,6.525,98.66,0.652,sometimes i'm that yearning for a smoke i'm nearly crazy an i dunno which is worst dyin one way or another,sometimes an that yearn in for a smoke o'm nearly crazy and i don't know which is worse dind when way ar tho ther
6829-68769-0016.flac,4.12,62.153,0.4,he unlocked the door and called here's visitors tom,he a locked the door an called here's visitors talm
6829-68769-0017.flac,3.545,52.204,0.556,worse tom worse n ever replied the jailer gloomily,worse telem worse an arrow replied the jailor clumily
6829-68769-0018.flac,7.11,107.693,0.261,miss de graf said kenneth noticing the boy's face critically as he stood where the light from the passage fell upon it,mister grafh said kenneth noticing the boys face critically as he stood where the white from the passage fell upon it
6829-68769-0019.flac,2.665,39.849,0.4,sorry we haven't any reception room in the jail,sarry we have an any orception rom in the jail
6829-68769-0020.flac,5.125,76.505,0.5,sit down please said gates in a cheerful and pleasant voice there's a bench here,sit tel plase said gates an atuerful in pleasant voice there's a pencheer
6829-68769-0021.flac,7.895,118.273,0.19,a fresh wholesome looking boy was tom gates with steady gray eyes an intelligent forehead but a sensitive rather weak mouth,a fresh holesome looking boy was tam gates wath steady gray eyes and intelligent forehead but a sensitive rather weak mouth
6829-68769-0022.flac,4.115,62.441,0.071,we have heard something of your story said kenneth and are interested in it,we have heard something of your story said kenneth and our interested in it
6829-68769-0023.flac,4.89,72.662,0.095,i didn't stop to think whether it was foolish or not i did it and i'm glad i did,i didn't stop to think whether it was foolish or not i did it and iu'm glad i did it
6829-68769-0024.flac,4.945,74.767,0.5,old will is a fine fellow but poor and helpless since missus rogers had her accident,ald well is a firein fellow but poor ind helpless sence missus roger's hat her accident
6829-68769-0025.flac,5.735,85.913,0.182,then rogers wouldn't do anything but lead her around and wait upon her and the place went to rack and ruin,then roters wouldn't do anything but leader around and wait upon her and the place went to reck and ruin
6829-68769-0026.flac,4.64,68.363,0.2,he spoke simply but paced up and down the narrow cell in front of them,he spoke simply but pacte up and down the narrow cell an tron of them
6829-68769-0027.flac,3.065,45.419,0.2,whose name did you sign to the check asked kenneth,whose name did she signe to the check asked kenneth
6829-68769-0028.flac,3.29,47.472,0.182,he is supposed to sign all the checks of the concern,he is supposed to sign all the checuks of the concert
6829-68769-0029.flac,2.04,29.78,0.429,it's a stock company and rich,it's a stopk company in ritch
6829-68769-0030.flac,4.91,73.949,0.312,i was bookkeeper so it was easy to get a blank check and forge the signature,i was bic keeper so it was easy to get a point cheqk and forched the signature
6829-68769-0031.flac,5.555,84.784,0.278,as regards my robbing the company i'll say that i saved them a heavy loss one day,as regards my robbing the company all say that i saved him i heavy lost one day
6829-68769-0032.flac,5.72,85.586,0.15,i discovered and put out a fire that would have destroyed the whole plant but marshall never even thanked me,i descovered im put out a fire that would have destroyed the whole plant but marchall never even thanked me
6829-68769-0033.flac,4.02,57.734,0.067,it was better for him to think the girl unfeeling than to know the truth,it was better for him to think the girl unfeeling than to now the truth
6829-68769-0034.flac,6.055,90.416,0.143,i'm going to see mister marshall said kenneth and discover what i can do to assist you thank you sir,i'm going to see mister marshall said kenneth and discover what i can do to as his tou thank you sir
6829-68769-0035.flac,2.755,40.89,0.077,it won't be much but i'm grateful to find a friend,at won't be much but i'm grateful to find a friend
6829-68769-0036.flac,5.555,82.497,0.333,they left him then for the jailer arrived to unlock the door and escort them to the office,they left him then for the jailor arrived to a lock the door and a scort hem to the office
6829-68769-0037.flac,2.53,36.862,0.4,i've seen lots of that kind in my day,as see lots of that kind of my day
6829-68769-0038.flac,2.505,35.929,0.571,and it ruins a man's disposition,and it ruins of an's just position
6829-68769-0039.flac,4.045,60.965,0.0,he looked up rather ungraciously but motioned them to be seated,he looked up rather ungraciously but motioned them to be seated
6829-68769-0040.flac,4.77,69.296,0.118,some girl has been here twice to interview my men and i have refused to admit her,some girl as been in here twice to interview my men and i have refused to admit her
6829-68769-0041.flac,2.66,37.897,0.0,i'm not electioneering just now,i'm not electioneering just now
6829-68769-0042.flac,2.175,31.779,0.167,oh well sir what about him,oh whel sir what about him
6829-68769-0043.flac,2.59,37.273,0.556,and he deserves a term in state's prison,and he deserves seterm and states prison
6829-68769-0044.flac,3.225,46.733,0.333,it has cost me twice sixty dollars in annoyance,it is caused me twice sixty dollars in anoyance
6829-68769-0045.flac,2.135,29.889,0.286,i'll pay all the costs besides,i'll pay all the cosbasides
6829-68769-0046.flac,2.57,36.732,0.333,you're foolish why should you do all this,your foolish wis should you do all this
6829-68769-0047.flac,2.325,33.393,0.0,i have my own reasons mister marshall,i have my own reasons mister marshall
6829-68769-0048.flac,6.495,97.43,0.304,give me a check for a hundred and fifty and i'll turn over to you the forged check and quash further proceedings,give me a cheqk for a hundred and fifty and i'llturn over to you the forgh ceck and cash further preceedings
6829-68769-0049.flac,7.4,111.801,0.211,he detested the grasping disposition that would endeavor to take advantage of his evident desire to help young gates,hi detested the grasping dispicious on that would endeavour to take advantage of his evident desire to help young gates
6829-68769-0050.flac,2.915,43.652,0.429,beth uneasy at his silence nudged him,beth uneasy at i sylenced nodged him
6829-68769-0051.flac,3.545,52.24,0.091,there was a grim smile of amusement on his shrewd face,there was a grim smile of amusement on his shrowd face
6829-68769-0052.flac,4.6,68.296,0.176,he might have had that forged check for the face of it if he'd been sharp,he might have had that forte check for the face of it if he ben sharp
6829-68769-0053.flac,6.36,95.111,0.1,and to think we can save all that misery and despair by the payment of a hundred and fifty dollars,and to think we can save all that misery and dispair by the payment of a hunted and fifty dollars
6930-75918-0000.flac,3.505,51.828,0.5,concord returned to its place amidst the tents,comincord would turne to its place anmids the tents
6930-75918-0001.flac,14.225,214.673,0.163,the english forwarded to the french baskets of flowers of which they had made a plentiful provision to greet the arrival of the young princess the french in return invited the english to a supper which was to be given the next day,the english foatded to the french baskets of flowers of which they had made a plantipl forvision to gree y arrival of the young princess the french ineturn invited the english to a supper which was to be given the next day
6930-75918-0002.flac,5.025,75.672,0.091,congratulations were poured in upon the princess everywhere during her journey,hingradulations were poured in upon the princess everywhere during her journey
6930-75918-0003.flac,23.315,349.067,0.109,from the respect paid her on all sides she seemed like a queen and from the adoration with which she was treated by two or three she appeared an object of worship the queen mother gave the french the most affectionate reception france was her native country and she had suffered too much unhappiness in england for england to have made her forget france,from the respect pain her on all sides she seemed like a queen and from the aderation with which she was treated by two or three she appeared an object of worship the queen mother gave the french the most effectionate reception flance was her native country and she had suffered twoo much inhappiness in england for england to have made her forgit france
6930-75918-0004.flac,11.065,166.761,0.226,she taught her daughter then by her own affection for it that love for a country where they had both been hospitably received and where a brilliant future opened before them,she tar her daughter wth hen by her own effection for it that love for a country where they had both been hispitibly received and where a brilliant future open for them
6930-75918-0005.flac,13.16,198.172,0.121,the count had thrown himself back on his seat leaning his shoulders against the partition of the tent and remained thus his face buried in his hands with heaving chest and restless limbs,they count had the rong himself back on his seat leaning his shoulders against the partitiong of the tent and remained thus his face buried in his hands with heaving chest and restless limbs
6930-75918-0006.flac,5.85,86.542,0.059,this has indeed been a harassing day continued the young man his eyes fixed upon his friend,this has indeed been a herassing day continued the young man his eyes fixed upon his friend
6930-75918-0007.flac,3.315,47.541,0.0,you will be frank with me i always am,you will be frank with me i always am
6930-75918-0008.flac,4.785,69.455,0.364,can you imagine why buckingham has been so violent i suspect,kan you imagine why bucking ham has been so finlent i suspect
6930-75918-0009.flac,7.28,110.066,0.25,it is you who are mistaken raoul i have read his distress in his eyes in his every gesture and action the whole day,it is you mermous daken rol i have read his distress in his eyes in his ever jesture and action the whole day
6930-75918-0010.flac,3.035,43.127,0.0,i can perceive love clearly enough,i can perceive love clearly enough
6930-75918-0011.flac,3.195,46.089,0.0,i am convinced of what i say said the count,i am convinced of what i say said the count
6930-75918-0012.flac,1.94,25.718,0.5,it is annoyance then,it is a noyance then
6930-75918-0013.flac,2.94,40.613,0.375,in those very terms i even added more,in those very terms i even had in lor
6930-75918-0014.flac,16.84,241.075,0.233,but continued raoul not interrupted by this movement of his friend heaven be praised the french who are pronounced to be thoughtless and indiscreet reckless even are capable of bringing a calm and sound judgment to bear on matters of such high importance,but continued ral not interupted by this moment of his friend heavenly praised the french who are pronounced to be thougless in indiscreet reckless even ar capable of bringing a calm and sound judgment to bare matters of such high importance
6930-75918-0015.flac,6.38,91.791,0.421,thus it is that the honor of three is saved our country's our master's and our own,thus it is not the honor of three is safed a country ar masters and are own
6930-75918-0016.flac,10.015,139.14,0.069,yes i need repose many things have agitated me to day both in mind and body when you return to morrow i shall no longer be the same man,yes i need repose many things have agtitated me to day both in mind and body when you return to morrow i shall kno longer be the same man
6930-75918-0017.flac,6.16,86.697,0.125,but in this friendly pressure raoul could detect the nervous agitation of a great internal conflict,but in this friendly pressure ral could detect the nervous agutation of a great internal conflict
6930-75918-0018.flac,10.81,151.566,0.038,the night was clear starlit and splendid the tempest had passed away and the sweet influences of the evening had restored life peace and security everywhere,the night was clear starlet and splendid the tempest had passed away and the sweet influences of the evening had restored life peace and security everywhere
6930-75918-0019.flac,11.6450625,162.365,0.29,upon the large square in front of the hotel the shadows of the tents intersected by the golden moonbeams formed as it were a huge mosaic of jet and yellow flagstones,u pan the large square in frant of the hotel the shadows of the tents in a sected by the golden moon beams formed as it were a huge mosige of jet and yellow flagstones
6930-75918-0020.flac,14.4,205.186,0.211,bragelonne watched for some time the conduct of the two lovers listened to the loud and uncivil slumbers of manicamp who snored as imperiously as though he was wearing his blue and gold instead of his violet suit,bralaon washed for some time the conduct of the two lovers listened to the loud and unsilto slumbers of manacamp who snored as impersly as though he was wearing his bloe and gold is tead of his violet suit
7021-79730-0000.flac,2.44,33.784,0.0,the three modes of management,the three modes of management
7021-79730-0001.flac,11.49,163.382,0.077,to suppose that the object of this work is to aid in effecting such a substitution as that is entirely to mistake its nature and design,to suppose that the object of this work is to aid in affecting such a substitution as that is intirely to mistake its nature and design
7021-79730-0002.flac,2.69,36.49,0.5,by reason and affection,i reason and affectioned
7021-79730-0003.flac,32.88,473.427,0.194,as the chaise drives away mary stands bewildered and perplexed on the door step her mind in a tumult of excitement in which hatred of the doctor distrust and suspicion of her mother disappointment vexation and ill humor surge and swell among those delicate organizations on which the structure and development of the soul so closely depend doing perhaps an irreparable injury,as the chas strives away merry stands bewildered and perplexed on the door stap her mind in a tumult of excitement in which hatred of the doctor distrust and suspicion of her mother disappointment vexation and ill humour sirge and swell among those delegate organizations on which the structure and te velopment of the soul so closely depend doing perhaps and a reprable injury
7021-79730-0004.flac,17.945,262.78,0.152,the mother as soon as the chaise is so far turned that mary can no longer watch the expression of her countenance goes away from the door with a smile of complacency and satisfaction upon her face at the ingenuity and success of her little artifice,the mother as soon as the chase is so far turned that mary can no longer watch the expression of hor continence goes away from the door with a smile of complaisency and senisfaction on her face at the ingenuity and success of her little eartifice
7021-79730-0005.flac,8.01,117.405,0.043,so you will be a good girl i know and not make any trouble but will stay at home contentedly won't you,so you will be a good girl i know and not make any trouble but wi'll stay at home contentedly won't you
7021-79730-0006.flac,11.34,166.623,0.154,the mother in managing the case in this way relies partly on convincing the reason of the child and partly on an appeal to her affection,the mother in managing the case in this way relized partly un convincing the reason of the child and partly on an appealed to her evection
7021-79730-0007.flac,12.455,183.913,0.028,if you should not be a good girl but should show signs of making us any trouble i shall have to send you out somewhere to the back part of the house until we are gone,if you should not be a good girl but should show signs of making us any trouble i shall have to send you out somewhere to the back part of the house untill we are gone
7021-79730-0008.flac,11.765,176.486,0.125,but this last supposition is almost always unnecessary for if mary has been habitually managed on this principle she will not make any trouble,but this lest opposition is almost always unnecessary for  if mary has been abitually managed on this principle she will not make any trouble
7021-79730-0009.flac,12.585,189.465,0.0,it is indeed true that the importance of tact and skill in the training of the young and of cultivating their reason and securing their affection can not be overrated,it is indeed true that the importance of tact and skill in the training of the young and of cultivating their reason and securing their affection can not be overrated
7127-75946-0000.flac,19.475,297.563,0.136,at the conclusion of the banquet which was served at five o'clock the king entered his cabinet where his tailors were awaiting him for the purpose of trying on the celebrated costume representing spring which was the result of so much imagination and had cost so many efforts of thought to the designers and ornament workers of the court,at the conclusion of the banquen which was served at five o'clock the king entered his cabinet where his tailor s or awaiting him for the purpose of trying on the selebrated custume representing spring which was the result of so much imagination and had caust so many efforts of thought to the designers and ornabent workers of the court
7127-75946-0001.flac,2.17,32.191,0.0,ah very well,ah very well
7127-75946-0002.flac,13.19,198.355,0.25,let him come in then said the king and as if colbert had been listening at the door for the purpose of keeping himself au courant with the conversation he entered as soon as the king had pronounced his name to the two courtiers,lam come in then said the king and is if coled bare had been lisening at the door for the purpose of keeping himself alchoronp with the conversation he entered his soon as they king had pronounced his name to the two coartiers
7127-75946-0003.flac,4.81,73.631,0.5,gentlemen to your posts whereupon saint aignan and villeroy took their leave,jentleman to your posts where upon saint anon and viele ri took their leave
7127-75946-0004.flac,4.49,64.924,0.0,certainly sire but i must have money to do that what,certainly sire but i must have money to do that what
7127-75946-0005.flac,2.67,41.04,0.167,what do you mean inquired louis,what do you mean inquired louise
7127-75946-0006.flac,7.98,121.999,0.074,he has given them with too much grace not to have others still to give if they are required which is the case at the present moment,he has given them with twoo much grace not to have others still to give if they are required which as the case at the present moment
7127-75946-0007.flac,4.755,72.043,0.0,it is necessary therefore that he should comply the king frowned,it is necessary therefore that he should comply the king frowned
7127-75946-0008.flac,4.46,68.729,0.1,does your majesty then no longer believe the disloyal attempt,does your imajesty then no longer believe the disloyal attempt
7127-75946-0009.flac,4.72,71.153,0.083,not at all you are on the contrary most agreeable to me,not at all you are on the contrary most dagreeable to me
7127-75946-0010.flac,3.6,52.586,0.111,your majesty's plan then in this affair is,your majesty's planned then in this affair is
7127-75946-0011.flac,3.17,47.49,0.0,you will take them from my private treasure,you will take them from my private treasure
7127-75946-0012.flac,9.87,150.277,0.333,the news circulated with the rapidity of lightning during its progress it kindled every variety of coquetry desire and wild ambition,the news circulated with the repedity of likening during its progress it candled every variet if cocatry desire and whild ambition
7127-75946-0013.flac,8.58,129.097,0.091,the king had completed his toilette by nine o'clock he appeared in an open carriage decorated with branches of trees and flowers,the king had completed his toilet by nine o'clock he appeared in an open carriage decorated with branches of trees and flouts
